name,detail_url,listing_address,listing_languages,map_url,listing_website,services,regular_staff_languages,casual_volunteer_languages,reduced_mobility_access,daycare,contact_hours,phone,email,website,address,holiday_period,territory_covered,administrative_region,municipality,source_last_updated
ABL Accès Accueil Action,https://www.quebec.ca/en/immigration/partners/155/abl-acces-accueil-action,"184, rue Saint-Eustache Saint-Eustache (Laurentides) J7R 2L7 Tel. : 514 570-3313","Français, Anglais, Espagnol, Arabe, Berbère, Portugais, Russe, Ukrainien, Roumain, Batoufam, Bankondji","https://www.google.ca/maps/place/184+Rue+Saint-Eustache,+Saint-Eustache,+QC+J7R+2L7/@45.5582506,-73.8959556,17z/data=!3m1!4b1!4m6!3m5!1s0x4cc9257e00a9ea8b:0xb751762efa731301!8m2!3d45.5582469!4d-73.8937669!16s%2Fg%2F11b8v6l0xx",https://www.abl-immigration.org,"Accueil, installation, intégration, renseignement et référence | Session Objectif intégration | Jumelage interculturel | Espace Parents | Personne ayant demandé l'asile (DA) - Recherche de logement","Français, Anglais, Espagnol, Arabe, Berbère, Portugais, Russe, Ukrainien, Roumain, Batoufam, Bankondji","Français, Anglais, Espagnol, Arabe, Berbère, Portugais, Russe, Ukrainien, Mandarin, Perse, Kurde, Wolof, Arménien, Hindi, Punjabi, Créole, Turc",Yes,,Du lundi au jeudi de 9 h à 16 h et vendredi de 9 h à 15 h.,514-570-3313,ablimmigration@gmail.com,http://www.abl-immigration.org,"184, rue Saint-Eustache Saint-Eustache (Québec) J7R 2L7 Voir sur la carte",Bureau fermé du 23 décembre au 2 janvier. Une veille sur les courriels et le téléphone est effectuée durant cette période de fermeture.,MRC Deux-Montagnes et MRC Thérèse-De-Blainville et Mirabel (15 villes).,Laurentides,Saint-Eustache,"June 10, 2025"
ABL Accès Accueil Action,https://www.quebec.ca/en/immigration/partners/181/abl-acces-accueil-action,"6, rue de l’Église, 3e étage Sainte-Thérèse (Laurentides) J7E 3L1 Tel. : 514 570-3313","Français, Anglais, Espagnol, Arabe, Berbère, Portugais, Russe, Ukrainien, Roumain, Batoufam, Bankondji","https://www.google.com/maps/place/6+Rue+de+l'Eglise,+Sainte-Th%C3%A9r%C3%A8se,+QC+J7E+1W9/@45.6401704,-73.8431629,16z/data=!4m6!3m5!1s0x4cc927d6f93068b7:0x577123026fc2357d!8m2!3d45.6401704!4d-73.8431629!16s%2Fg%2F11b8vcqkxm?entry=ttu&g_ep=EgoyMDI1MTAyOS4yIKXMDSoASAFQAw%3D%3D",https://www.abl-immigration.org,"Accueil, installation, intégration, renseignement et référence | Jumelage interculturel | Session Objectif intégration | Espace Parents | Personne ayant demandé l'asile (DA) - Recherche de logement","Français, Anglais, Espagnol, Arabe, Berbère, Portugais, Russe, Ukrainien, Roumain, Batoufam, Bankondji","Français, Anglais, Espagnol, Arabe, Berbère, Russe, Mandarin, Perse, Kurde, Wolof, Arménien, Hindi, Punjabi, Ukrainien, Portugais, Créole, Turc,",Yes,,Du lundi au jeudi de 9 h à 16 h et vendredi de 9 h à 15 h.,514 5703313,ablimmigration@gmail.com,http://www.abl-immigration.org,"6, rue de l’Église, 3e étage Sainte-Thérèse (Québec) J7E 3L1 Voir sur la carte",Bureau fermé du 23 décembre au 2 janvier. Une veille sur les courriels et le téléphone est effectuée durant cette période de fermeture.,MRC Deux-Montagnes et MRC Thérèse-De-Blainville et Mirabel (15 villes).,Laurentides,Sainte-Thérèse,"June 10, 2025"
Accompagnement des Femmes Immigrantes de l'Outaouais (AFIO),https://www.quebec.ca/en/immigration/partners/3/accompagnement-des-femmes-immigrantes-de-loutaouais-afio,"009-109, rue Wright Gatineau (Outaouais) J8X 2G7 Tel. : 819 776-6764 Fax : 819 776-5617","Français, Anglais, Arabe, Lingala, Créole, Kikongo, Tamoul, Mandarin, Allemand, Espagnol, Farsi, Swahili","http://maps.google.ca/maps?q=google.com/maps/place/109+Rue+Wright,+Gatineau,+QC+J8X+2G7/data=!4m2!3m1!1s0x4cce04f52e130017:0x732606b214e8788?sa=X&ved=1t:242&ictx=111, rue Wright, local 009 Gatineau, Québec J8X2G7",https://www.afio.ca,"Accueil, installation, intégration, renseignement et référence | Session Objectif intégration | Intervenant communautaire interculturel (ICI) - Femmes | Jumelage interculturel | Espace Parents | Personne ayant demandé l'asile (DA) - Recherche de logement","Français, Anglais, Arabe, Lingala, Créole, Kikongo, Tamoul, Mandarin, Allemand, Espagnol, Farsi, Swahili","Français, Mandarin, Espagnol, Hindi, Coréen, Allemand, Bulgare, Russe, Portugais, Créole, Somali, Anglais, Arabe",No,Available on site,"Du lundi au vendredi de 8 h 30 à 12 h et de 13 h à 16 h 30, jeudi de 16 h 30 à 18 h 30. Le vendredi les bureaux ferment à 13 h pendant la période estival.",819-776-6764,direction@afio.ca,http://www.afio.ca,"009-109, rue Wright Gatineau (Québec) J8X 2G7 Voir sur la carte",Bureau fermé entre Noël et le jour de l'An,MRC des Collines-de-l'Outaouais; MRC de la Vallée-de-la-Gatineau; MRC de Pontiac; MRC de Papineau; Ville de Gatineau,Outaouais,Gatineau,"June 10, 2025"
Accueil aux Immigrants de l'Est de Montréal (Pointe-Aux-Trembles),https://www.quebec.ca/en/immigration/partners/6/accueil-aux-immigrants-de-lest-de-montreal-pointe-aux-trembles,"14115, rue Prince-Arthur Montréal (Montréal) H1A 1A8 Tel. : 514 788-4343 Fax : 514 723-3619","Français, Anglais, Espagnol","https://www.google.com/maps/place/14115+Rue+Prince-Arthur,+Pointe-aux-Trembles,+QC+H1A+1A8/@45.6710556,-73.5118366,17z/data=!3m1!4b1!4m5!3m4!1s0x4cc8e17d2a88bb97:0x957eec1445664b6e!8m2!3d45.6710556!4d-73.5096479",https://www.aiemont.com,"Accueil, installation, intégration, renseignement et référence | Personne ayant demandé l'asile (DA) - Recherche de logement","Français, Anglais , Espagnol","Français, Anglais , Espagnol",Yes,,Du lundi au vendredi de 8 h à 17 h.,514-788-4343,aiem@qc.aira.com,http://www.aiemont.com,"14115, rue Prince-Arthur Montréal (Québec) H1A 1A8 Voir sur la carte",Bureau fermé 2 semaines durant la période de Noël et du jour de l'An,Saint-Léonard; Anjou; Pointe-aux-Trembles; Rivière-des-Prairies; Mercier-Est; Mercier Ouest,Montréal,Montréal,"June 10, 2025"
Accueil aux Immigrants de l'Est de Montréal (Rivière-Des-Prairies),https://www.quebec.ca/en/immigration/partners/7/accueil-aux-immigrants-de-lest-de-montreal-riviere-des-prairies,"9001, boulevard Perras Montréal (Montréal) H1E 3J7 Tel. : 514 872-0107 Fax : 514 723-3619","Français, Anglais, Espagnol, Créole","https://www.google.com/maps/place/9001+Boulevard+Perras,+Montr%C3%A9al,+QC+H1E+3J7/@45.6497644,-73.5811602,17z/data=!3m1!4b1!4m5!3m4!1s0x4cc8e034333e644f:0x161b89fbffa7892e!8m2!3d45.6497644!4d-73.5789715",https://www.aiemont.com,"Accueil, installation, intégration, renseignement et référence | Personne ayant demandé l'asile (DA) - Recherche de logement","Français, Anglais, Espagnol, Créole","Français, Anglais, Espagnol, Créole",Yes,,Du lundi au vendredi de 10 h à 17 h.,514-872-0107,aiem@qc.aira.com,http://www.aiemont.com,"9001, boulevard Perras Montréal (Québec) H1E 3J7 Voir sur la carte",Bureau fermé 2 semaines durant la période de Noël et du jour de l'An,Saint-Léonard; Anjou; Pointe-aux-Trembles; Rivière-des-Prairies; Mercier-Est; Mercier Ouest,Montréal,Montréal,"June 10, 2025"
Accueil aux Immigrants de l'Est de Montréal (St-Léonard),https://www.quebec.ca/en/immigration/partners/4/accueil-aux-immigrants-de-lest-de-montreal-st-leonard,"209-5960, rue Jean-Talon Est Montréal (Montréal) H1S 1M2 Tel. : 514 723-4939 Fax : 514 723-3619","Français, Anglais, Espagnol, Arabe (Algérie, Maroc, et international), Kabyle, Créole, Polonais, Peul, Wolof, Soussou, Malinké, Fon, Moré, Mossi","https://www.google.com/maps/place/5960+Rue+Jean-Talon+E,+Saint-L%C3%A9onard,+QC+H1S+1M2/data=!4m2!3m1!1s0x4cc91e8da470dd2d:0x27010ef87f816982?sa=X&ved=1t:242&ictx=111",https://www.aiemont.com,"Accueil, installation, intégration, renseignement et référence | Session Objectif intégration | Intervenant communautaire interculturel (ICI) - Femmes | Jumelage interculturel | Espace Parents | Personne ayant demandé l'asile (DA) - Recherche de logement | Jumelage interculturel","Français, Anglais, Espagnol, Arabe (Algérie, Maroc, et international), Kabyle, Créole, Polonais, Peul, Wolof, Soussou, Malinké, Fon, Moré, Mossi","Français, Anglais, Espagnol, Ukrainien, Arabe International, Portugais",Yes,Available on site,Du lundi au dimanche de 8 h à 17 h.,514-723-4939,aiem@qc.aira.com,http://www.aiemont.com,"209-5960, rue Jean-Talon Est Montréal (Québec) H1S 1M2 Voir sur la carte",Bureau fermé 2 semaines durant la période de Noël et du jour de l'An,Saint-Léonard; Anjou; Pointe-aux-Trembles; Rivière-des-Prairies; Mercier-Est; Mercier Ouest,Montréal,Montréal,"June 10, 2025"
Accueil et Intégration BSL Inc.,https://www.quebec.ca/en/immigration/partners/216/accueil-et-integration-bsl-inc,"1534, boulevard Jacques-Cartier Mont-Joli (Bas-Saint-Laurent) G5H 2V8 Tel. : 418 775-8445 Fax : 418 730-6737","Français, Anglais","https://www.google.com/maps/place/1534+Bd+Jacques+-+Cartier,+Mont-Joli,+QC+G5H+2V8/@48.5872289,-68.1925962,890m/data=!3m2!1e3!4b1!4m6!3m5!1s0x4c968753256a592d:0xf49fd98bce0c1882!8m2!3d48.5872289!4d-68.1900213!16s%2Fg%2F11c1xr3430?entry=ttu&g_ep=EgoyMDI1MDkyMy4wIKXMDSoASAFQAw%3D%3D",https://www.aibsl.org,"Accueil, installation, intégration, renseignement et référence | Jumelage interculturel","Français, Anglais","Français, Anglais, Espagnol, Créole (Haitien), Lingala, Arabe, Wolof, Sango, Swahili, Zarma, Vietnamien, Mina",Yes,,Du lundi au vendredi de 9 h à 12 h et de 13 h à 16 h.,418-775-8445,immigration@aibsl.org,http://www.aibsl.org,"1534, boulevard Jacques-Cartier Mont-Joli (Québec) G5H 2V8 Voir sur la carte",Bureau fermé 2 semaines pendant le temps de fêtes,Les municipalités de la MRC de La Mitis,Bas-Saint-Laurent,Mont-Joli,"June 10, 2025"
Accueil et Intégration BSL Inc.,https://www.quebec.ca/en/immigration/partners/9/accueil-et-integration-bsl-inc,"192, rue Saint-Germain Est Rimouski (Bas-Saint-Laurent) G5L 1A8 Tel. : 581 824-1662 Fax : 418 730-6737","Français, Anglais, Espagnol, Arabe, Wolof, Haoussa, Sonrai, Polonais, Italien",https://goo.gl/maps/aVGBK6yDLvEWarG1A,https://www.aibsl.org,"Accueil, installation, intégration, renseignement et référence | Session Objectif intégration | Jumelage interculturel | Installation et accompagnement des personnes réfugiées prises en charge par l'État | Intervenant communautaire interculturel (ICI) Santé-Scolaire-Petite enfance-Jeunesse | Intervenant communautaire interculturel (ICI) - Femmes | Espace Parents","Français, Anglais, Espagnol,Arabe, Wolof, Haoussa, Sonrai, Polonais, Italien","Français, Anglais, Espagnol, Lingala, Sango, Swahili, Kirundi, Kinyarwanda, Créole (Haitien), Wolof",Yes,Available on site,Du lundi au vendredi de 9 h à 12 h et de 13 h à 16 h.,581-824-1662,accueil@aibsl.org,http://www.aibsl.org,"192, rue Saint-Germain Est Rimouski (Québec) G5L 1A8 Voir sur la carte",Bureau fermé 2 semaines pendant le temps de fêtes,MRC Rimouski-Neigette,Bas-Saint-Laurent,Rimouski,"June 10, 2025"
Accueil pour Immigrants et Réfugiés Du Sud-ouest de Montréal Centre PRISME,https://www.quebec.ca/en/immigration/partners/11/accueil-pour-immigrants-et-refugies-du-sud-ouest-de-montreal-centre-prisme,"110-414, avenue Lafleur Montréal (Montréal) H8R 3H6 Tel. : 514 364-0939 Fax : 514 364-9992","Français, Anglais, Espagnol, Serbe, Russe, Punjabi, Arabe, Bulgare, Moldave, Hindi","http://maps.google.ca/maps?q=414, rue Lafleur, bureau 1.10 Montréal, Québec H8R3H6",https://www.airsomprisme.org,"Accueil, installation, intégration, renseignement et référence | Personne ayant demandé l'asile (DA) - Recherche de logement","Français, Anglais, Espagnol, Serbe, Russe, Punjabi, Arabe, Bulgare, Moldave, Hindi","Français, Anglais, Punjabi, Espagnol",,,"Du lundi au vendredi de 8 h 30 à 12 h et de 13 h à 16 h 30, et de 17 h 30 à 21 h 30.",514-364-0939,info@airsomprisme.org,http://www.airsomprisme.org,"110-414, avenue Lafleur Montréal (Québec) H8R 3H6 Voir sur la carte",Bureau fermé 2 semaines durant la période de Noël et du jour de l'An,"Sud-Ouest de Montréal (LaSalle, Lachine et Ville-Émard)",Montréal,Montréal,"June 10, 2025"
Accueil-Parrainage Outaouais,https://www.quebec.ca/en/immigration/partners/12/accueil-parrainage-outaouais,"124, rue Jeanne-d'Arc Gatineau (Outaouais) J8Y 2H7 Tel. : 819 777-2960 Fax : 819 777-1739","Français, Anglais, Espagnol, Swahili, Italien, Dari, Kirundi, Croate, Farsi","http://maps.google.ca/maps?q=124, rue Jeanne-d'Arc Gatineau, Québec J8Y2H7",https://www.apo-qc.org,"Accueil, installation, intégration, renseignement et référence | Jumelage interculturel | Installation et accompagnement des personnes réfugiées prises en charge par l'État | Personne ayant demandé l'asile (DA) - Recherche de logement | Intervenant communautaire interculturel (ICI) Santé-Scolaire-Petite enfance-Jeunesse | Séances d'information pour les DA","Français, Anglais, Espagnol, Swahili, Italien, Dari, Kirundi, Croate, Farsi","Français, Anglais",,,Du lundi au vendredi de 8 h 30 à 16 h 30.,819-777-2960,direction@apo-qc.org,http://www.apo-qc.org,"124, rue Jeanne-d'Arc Gatineau (Québec) J8Y 2H7 Voir sur la carte",Services offerts toute l'année,MRC des Collines-de-l'Outaouais; MRC de la Vallée-de-la-Gatineau; MRC de Pontiac; MRC de Papineau; Ville de Gatineau,Outaouais,Gatineau,"June 10, 2025"
Action Famille Lavaltrie Inc.,https://www.quebec.ca/en/immigration/partners/13/action-famille-lavaltrie-inc,"1725, rue Notre-Dame Lavaltrie (Lanaudière) J5T 1S2 Tel. : 450 586-0733 Fax : 450-586-6652","Français, Anglais, Espagnol, Créole","https://www.google.com/maps/place/1725+Rue+Notre-Dame,+Lavaltrie,+QC+J5T+1S2/@45.8895066,-73.2756909,17z/data=!3m1!4b1!4m5!3m4!1s0x4cc8ed59e35b9ff7:0x3393826508eacfc0!8m2!3d45.8895066!4d-73.2735021",https://www.actionfamillelavaltrie.org.,"Accueil, installation, intégration, renseignement et référence | Jumelage interculturel | Intervenant communautaire interculturel (ICI)","Français, Anglais, Espagnol, Créole","Français, Anglais, Arabe, Espagnol, Créole",No,Available on site,"Du lundi au vendredi de 9 h à 16 h. L'organisme est disponible à offrir des services les fins de semaine ou les soirs, selon le besoin et la disponibilité de la clientèle cible.",450-586-0733,actionfamillelavaltrie@bellnet.ca,http://www.actionfamillelavaltrie.org.,"1725, rue Notre-Dame Lavaltrie (Québec) J5T 1S2 Voir sur la carte",Bureau fermé 2 semaines durant la période de Noël et du jour de l'An,Les municipalités de la MRC D'Autry,Lanaudière,Lavaltrie,"June 10, 2025"
"Agora Boréale, Association Interculturelle de Lebel-Sur-Quévillon",https://www.quebec.ca/en/immigration/partners/16/agora-boreale-association-interculturelle-de-lebel-sur-quevillon,"60, Place Quévillon Lebel-sur-Quévillon (Nord-du-Québec) J0Y 1X0 Tel. : 819 755-7550","Français, Anglais, Espagnol, Créole","https://www.google.com/maps/place/60+Pl.+Quevillon,+Lebel-sur-Qu%C3%A9villon,+QC+J0Y+1X0/@49.0528189,-76.9807341,441m/data=!3m2!1e3!4b1!4m6!3m5!1s0x4cdfc3f2505a4afd:0x1b23f09377744797!8m2!3d49.0528189!4d-76.9781592!16s%2Fg%2F11lclvmmy9?entry=ttu&g_ep=EgoyMDI1MDkyNC4wIKXMDSoASAFQAw%3D%3D",https://fr-ca.facebook.com/agoraboreale/,"Accueil, installation, intégration, renseignement et référence | Jumelage interculturel","Français, Anglais, Espagnol, Créole","Arabe, Russe, Tagalog, Anglais",Yes,,Du lundi au vendredi de 8 h 30 à 12 h et de 13 h à 16 h 30.,819-755-7550,agora.boreale@gmail.com,https://fr-ca.facebook.com/agoraboreale/,"60, Place Quévillon Lebel-sur-Quévillon (Québec) J0Y 1X0 Voir sur la carte",Bureau fermé 2 semaines durant la période de Noël et du jour de l'An,Lebel-sur-Quévillon,Nord-du-Québec,Lebel-sur-Quévillon,"June 10, 2025"
ALAC (Alliance pour L'Accueil et l'Intégration des Immigrants-es),https://www.quebec.ca/en/immigration/partners/17/alac-alliance-pour-laccueil-et-lintegration-des-immigrants-es,"350-5165, chemin Queen-Mary Montréal (Montréal) H3W 1X7 Tel. : 514 737-3642 Fax : 514 737-3514","Français, Anglais, Espagnol, Arabe","http://maps.google.ca/maps?q=5165, chemin Queen-Mary, bureau 350 Montréal, Québec H3W1X7",https://www.alac.qc.ca,"Accueil, installation, intégration, renseignement et référence | Session Objectif intégration | Jumelage interculturel | Personne ayant demandé l'asile (DA) - Recherche de logement","Français, Anglais, Espagnol, Arabe","Français, Anglais, Espagnol, Arabe",,,"Lundi de 9 h à 12 h et de 13 h à 21 h, mardi, mercredi, jeudi et vendredi de 9 h à 12 h, de 13 h à 16 h 30 et de 17 h à 21 h.",514-737-3642,info@alac.qc.ca,http://www.alac.qc.ca,"350-5165, chemin Queen-Mary Montréal (Québec) H3W 1X7 Voir sur la carte",Bureau fermé pendant la période des fêtes,Côte-des-Neiges; Notre-Dame-de-Grâce,Montréal,Montréal,"June 10, 2025"
Alliance Carrière Travail (ACT) (Brossard),https://www.quebec.ca/en/immigration/partners/183/alliance-carriere-travail-act-brossard,7845 boul. Taschereau Brossard (Montérégie) J4Y 1A4 Tel. : 450 462-2003 Fax : 450 462-3733,"Français, Anglais, Arabe, Espagnol, Roumain, Polonais, Créole",https://maps.app.goo.gl/9saRssoAFgFufLCj9,https://www.alliancect.ca,Session Objectif intégration,"Français, Anglais, Arabe, Espagnol, Roumain, Polonais, Créole",Français uniquement,Yes,,"Du lundi au jeudi de 8 h 30 à 12 h et de 13 h à 16 h 30, le vendredi de 8 h 30 à 12 h. Des rencontres en soirée sont offertes selon les besoins de la clientèle.",450-462-2003,info@alliancect.ca,http://www.alliancect.ca,7845 boul. Taschereau Brossard (Québec) J4Y 1A4 Voir sur la carte,Bureau fermé 2 semaines durant la période des fêtes,"Agglomération de Longueuil (Longueuil, Saint Lambert, Brossard, Saint-Bruno-de-Montarville et Boucherville)",Montérégie,Brossard,"June 10, 2025"
Alliance Carrière Travail (ACT) (Châteauguay),https://www.quebec.ca/en/immigration/partners/180/alliance-carriere-travail-act-chateauguay,265 boulevard d’Anjou Châteauguay (Montérégie) J6J 5J9 Tel. : 450 699-4545 Fax : 450 462-3733,"Français, Anglais, Arabe, Espagnol, Roumain, Polonais, Créole",https://maps.app.goo.gl/5QN5wwG4evkbj9qdA,https://www.alliancect.ca,"Accueil, installation, intégration, renseignement et référence | Session Objectif intégration","Français, Anglais, Arabe, Espagnol, Roumain, Polonais, Créole",ND (pas de bénévoles ni personnel occasionnel),,,"Le lundi et mardi de 8 h 30 à 12 h et de 13 h à 16 h 30, le mercredi de 10 h 30 à 12 h et de 13 h à 16 h 30 et le jeudi et vendredi de 8 h 30 à 12 h. Des rencontres en soirée sont offertes selon les besoins de la clientèle.",450-699-4545,info@alliancect.ca,http://www.alliancect.ca,265 boulevard d’Anjou Châteauguay (Québec) J6J 5J9 Voir sur la carte,Bureau fermé 2 semaines durant la période des fêtes,"Les municipalités de la MRC Roussillon (Châteauguay, Saint-Isidore, SainteMartine, Mercier et Léry.); MRC Jardins-de-Napierville (Saint-Rémi, Hemmingford, Canton, Napierville, Saint-Bernard-de-Lacolle, SainteClothilde, Saint-Cyprien-de-Napierville, Saint-Édouard)",Montérégie,Châteauguay,"June 10, 2025"
Alliance Carrière Travail (ACT) (Longueuil),https://www.quebec.ca/en/immigration/partners/179/alliance-carriere-travail-act-longueuil,"13, rue Saint-Laurent Est Longueuil (Montérégie) J4H 4B7 Tel. : 450 462-2003 Fax : 450 462-3733","Français, Anglais, Arabe, Espagnol, Roumain, Polonais, Créole",https://maps.app.goo.gl/SagAjNKxApQvqJk56,https://www.alliancect.ca,Session Objectif intégration,"Français, Anglais, Arabe, Espagnol, Roumain, Polonais, Créole",ND (pas de bénévoles ni personnel occasionnel),,,"Du lundi au jeudi de 8 h 30 à 12 h et de 13 h à 16 h 30, le vendredi de 8 h 30 à 12 h. Des rencontres en soirée sont offertes selon les besoins de la clientèle.",450-462-2003,info@alliancect.ca,http://www.alliancect.ca,"13, rue Saint-Laurent Est Longueuil (Québec) J4H 4B7 Voir sur la carte",Bureau fermé 2 semaines durant la période des fêtes,"Agglomération de Longueuil (Longueuil, Saint Lambert, Brossard, Saint-Bruno-de-Montarville et Boucherville)",Montérégie,Longueuil,"June 10, 2025"
Alliance Carrière Travail (ACT) (Longueuil),https://www.quebec.ca/en/immigration/partners/218/alliance-carriere-travail-act-longueuil,"840, rue Notre-Dame Saint-Rémi (Montérégie) J0L 2L0 Tel. : 450 977-0223 Fax : 450 462-3733","Français, Anglais, Arabe, Espagnol, Roumain, Polonais, Créole","https://www.google.ca/maps/place/840+R.+Notre+Dame,+Saint-R%C3%A9mi,+QC+J0L+2L0/@45.2588939,-73.6207619,16z/data=!3m1!4b1!4m6!3m5!1s0x4cc97218e8a5eba3:0x831895031873265!8m2!3d45.2588939!4d-73.618187!16s%2Fg%2F11c4wmssks?entry=ttu&g_ep=EgoyMDI1MDkyMy4wIKXMDSoASAFQAw%3D%3D",https://www.alliancect.ca,"Accueil, installation, intégration, renseignement et référence | Session Objectif intégration","Français, Anglais, Arabe, Espagnol, Roumain, Polonais, Créole",ND (pas de bénévoles ni personnel occasionnel),,,"Lundi, mercredi et vendredi : sur rendez-vous, mardi et jeudi de 8 h 30 à 12 h et de 13 h à 16 h 30.",450-977-0223,info@alliancect.ca,http://www.alliancect.ca,"840, rue Notre-Dame Saint-Rémi (Québec) J0L 2L0 Voir sur la carte",Bureau fermé 2 semaines pendant le temps des fêtes,Hemmingford; St-Cyprien-de-Napierville; SaintMichel; Saint-Clotilde; Napierville; Saint-Édouard; Saint-Patrice-de-Sherrington; Saint-Bernard-de Lacolle; Saint-Jacques-le-Mineur; Saint-Rémi,Montérégie,Saint-Rémi,"June 10, 2025"
AMINATE Accueil Multiethnique et Intégration de Nouveaux Arrivants à Terrebonne et les Environs,https://www.quebec.ca/en/immigration/partners/1/aminate-accueil-multiethnique-et-integration-de-nouveaux-arrivants-a-terrebonne-et-les-environs,"500, boulevard des Seigneurs Terrebonne (Lanaudière) J6W 1T3 Tel. : 450 492-7989 Fax : 450 492-1303","Français, Anglais, Arabe, Espagnol, Créole, Wolof, Kabyle","https://www.google.ca/maps/place/500+Boulevard+des+Seigneurs,+Terrebonne,+QC+J6W+1T3/@45.7036425,-73.6353195,17z/data=!3m1!4b1!4m5!3m4!1s0x4cc8de68c4748cb9:0x3dfaf4f5260f45f4!8m2!3d45.7036388!4d-73.6331308",https://www.aminate.qc.ca,"Accueil, installation, intégration, renseignement et référence | Session Objectif intégration | Espace Parents | Personne ayant demandé l'asile (DA) - Recherche de logement","Français, Anglais, Arabe, Espagnol, Créole, Wolof, Kabyle","Français, Anglais, Espagnol",No,Available on site,"Du lundi au vendredi de 8 h 30 à 12 h et de 13 h à 16 h 30, lundi et mercredi de 17 h 30 à 19 h. Samedi de 8 h à 12h et de 13 h à 16 h pour les activités extérieures.",450-492-7989,info@aminate.qc.ca,http://www.aminate.qc.ca,"500, boulevard des Seigneurs Terrebonne (Québec) J6W 1T3 Voir sur la carte",Bureau fermé 2 semaines durant la période de Noël et du jour de l'An et 2 semaine en été pendant les vacances de la construction.,MRC Des Moulins; MRC de Terrebonne; MRC de Mascouche,Lanaudière,Terrebonne,"June 10, 2025"
Bienvenue à Notre-Dame-De-Grâce,https://www.quebec.ca/en/immigration/partners/22/bienvenue-a-notre-dame-de-grace,"6580, rue Sherbrooke Ouest Montréal (Montréal) H4B 1N5 Tel. : 514 561-5850 Fax : 438 927-5850","Français, Anglais, Arabe, Coréen, Espagnol, Ourdou, Tigrinya, Mandarin, Portugais, Russe, Persan, Dari, Ukrainien","https://www.google.com/maps/place/Bienvenue+%C3%A0+Notre-Dame-de-Gr%C3%A2ce/@45.4632815,-73.6294281,793m/data=!3m2!1e3!4b1!4m6!3m5!1s0x4cc910b47d5f0907:0xb262206b0006c37c!8m2!3d45.4632815!4d-73.6294281!16s%2Fg%2F11fxnj7wt1?entry=ttu&g_ep=EgoyMDI2MDQwOC4wIKXMDSoASAFQAw%3D%3D",https://bienvenuendg.ca,"Accueil, installation, intégration, renseignement et référence | Session Objectif intégration | Jumelage interculturel | Personne ayant demandé l'asile (DA) - Recherche de logement","Français, Anglais, Arabe, Coréen, Espagnol, Ourdou, Tigrinya, Mandarin, Portugais, Russe, Persan, Dari, Ukrainien","Hindi, Kurde, Tamoul",No,Available on site,Du lundi au vendredi de 9 h 30 à 12 h et de 13 h à 16 h 30.,514-561-5850,info@bienvenuendg.ca,https://bienvenuendg.ca,"6580, rue Sherbrooke Ouest Montréal (Québec) H4B 1N5 Voir sur la carte",Bureau fermé durant le temps des fêtes,"Côte-des-Neiges; Notre-Dame-de-Grâce; Le Sud-Ouest; Ville-Marie; Lachine; LaSalle; Côte-Saint-Paul; Hampstead, Montréal Ouest",Montréal,Montréal,"June 10, 2025"
